{
  "target": "codex",
  "displayName": "Codex",
  "sourceRoot": "pstack",
  "outputRoot": ".agents/plugins/pstack",
  "manifestSource": "pstack/.codex-plugin/plugin.json",
  "manifestDestination": ".codex-plugin/plugin.json",
  "referenceManifest": "pstack/.cursor-plugin/plugin.json",
  "marketplace": {
    "path": ".agents/plugins/marketplace.json",
    "name": "codex-pstack",
    "pluginName": "pstack",
    "sourcePointer": "./.agents/plugins/pstack"
  },
  "portabilityRecord": "references/runtime/skill-portability.md",
  "portabilityColumn": "Codex",
  "runtimeMapping": "references/runtime/codex.md",
  "stopPageTitle": "Unsupported on Codex",
  "stopPageMappingLink": "../../../references/runtime/codex.md",
  "generatedBy": "scripts/generate-codex-pstack.mjs",
  "regenerateCommand": "node scripts/generate-codex-pstack.mjs",
  "manifestChecks": "codex",
  "bannedVocabularies": [
    "cursor-exclusive",
    "cursor-shared-with-claude",
    "claude-exclusive"
  ],
  "forbiddenGeneratedDirectories": [
    "agents",
    "automations",
    "codex-skills"
  ],
  "requiredSkills": [
    "poteto-mode",
    "recall"
  ],
  "requiredAgents": [],
  "unsupportedResources": [
    {
      "path": "poteto-mode/playbooks/autonomous-run.md",
      "reason": "The workflow depends on unavailable loop and cloud-agent primitives."
    },
    {
      "path": "poteto-mode/playbooks/autopilot-full.md",
      "reason": "The workflow depends on unavailable cloud-agent orchestration."
    },
    {
      "path": "poteto-mode/playbooks/autopilot-stack.md",
      "reason": "The workflow depends on unavailable cloud-agent orchestration."
    },
    {
      "path": "poteto-mode/playbooks/babysit.md",
      "reason": "The workflow depends on excluded pull-request monitoring utilities and unavailable loop behavior."
    },
    {
      "path": "poteto-mode/playbooks/multi-phase-plan.md",
      "reason": "The workflow depends on excluded utilities and unsupported execution routes."
    },
    {
      "path": "poteto-mode/playbooks/shipping.md",
      "reason": "The workflow depends on excluded pull-request monitoring utilities and unavailable loop behavior."
    },
    {
      "path": "poteto-mode/playbooks/worktree-cleanup.md",
      "reason": "The workflow depends on unavailable agent and worktree bookkeeping."
    }
  ],
  "runtimeResources": [
    "poteto-mode/scripts/orch/session-orch.ts",
    "poteto-mode/scripts/orch/journal.ts",
    "poteto-mode/scripts/orch/program.ts",
    "show-me-your-work/scripts/log.sh"
  ],
  "copiedSkillResources": [
    {
      "source": "agents/comment-sicko.md",
      "destination": "skills/no-comments/references/comment-sicko.md"
    }
  ],
  "platformTermAllowlist": []
}
